{
  "schema_version": 1,
  "_note": "Stage 4 optimizer test: prediction LR 3e-4, organizer LR 1e-4, and legacy dense additive background.",
  "core": {
    "model": {
      "core_honf": {
        "additive_background_mode": "dense_query_attention"
      }
    },
    "training": {
      "learning_rate": 0.0003,
      "organizer_learning_rate": 0.0001
    }
  },
  "case": {}
}
